pays,visa,formalites,argent,budget_repere,prises,internet,apps,eau,pourboire,do_dont,urgences,decalage
Kazakhstan,"Aucun visa jusqu'à 30 jours pour les Français. Passeport valide 6 mois après la sortie — vérifier une dernière fois sur diplomatie.gouv.fr avant le départ.","Rien à remplir avant d'arriver : le tampon suffit. Facile !","Le tenge (KZT). Repère : 1 € ≈ 600 tenge — vous serez tous millionnaires en billets ! Carte OK à Almaty, mais cash indispensable dès qu'on sort de la ville. Retraits faciles aux ATM (Kaspi, Halyk).","Un bon repas local (plov, lagman, manty) : 2 000–4 000 KZT, soit 3 à 7 €.","Prises C/F comme en France, 220 V — pas d'adaptateur, on démarre tranquille.","eSIM (Airalo/Holafly) ou carte SIM Beeline/Tele2 à l'aéroport, quasi donnée. Bonne 4G en ville, plus rien dans les montagnes — prévoir les cartes hors ligne.","Yandex Go = LE taxi local (comme Uber, prix affichés, pas de négo). 2GIS = cartes hors ligne ultra détaillées, l'app préférée d'Asie centrale.","Eau du robinet : non. Bouteilles ou gourde filtrante partout.","Pas la culture du pourboire : on arrondit, c'est tout. Certains restos ajoutent 10 % de service.","À FAIRE : accepter le thé quand on vous l'offre (refuser vexe) • se déchausser en entrant chez quelqu'un. À ÉVITER : poser le pain à l'envers ou le jeter — le pain est sacré ici.","112 (numéro unique)","+3 h sur Paris. Quand Emma se lève à 8 h, il est 5 h à la maison."
Kirghizistan,"Aucun visa jusqu'à 60 jours pour les Français — le plus simple du voyage. Vérifier une dernière fois avant le départ.","Rien à remplir. Tampon et c'est parti vers les montagnes.","Le som (KGS). Repère : 1 € ≈ 100 soms — la conversion la plus facile du voyage. CASH ROI : hors de Bichkek, la carte ne sert presque à rien. Retirer en ville avant de partir vers Issyk-Kul (le tour se paie en dollars cash, prévus).","Un repas local (beshbarmak, lagman) : 300–500 soms, soit 3 à 5 €.","Prises C/F comme en France, 220 V — toujours pas d'adaptateur.","SIM O! ou Beeline pour trois fois rien. Zéro réseau dans les vallées : télécharger cartes et playlists avant de partir en tour.","Yandex Go à Bichkek. 2GIS encore une fois. En montagne : pas d'app, des chevaux.","Eau du robinet : non. En altitude, les sources semblent pures mais on filtre quand même.","Pas attendu. Pour les guides et hôtes du tour, une enveloppe en fin de séjour fait toujours plaisir.","À FAIRE : goûter le kymyz (lait de jument fermenté) au moins UNE fois — grimace autorisée, refus poli possible ensuite • laisser les aînés se servir d'abord. À ÉVITER : marcher sur le seuil d'une yourte en entrant, ça porte malheur.","112 (numéro unique)","+4 h sur Paris."
Mongolie,"Aucun visa jusqu'à 30 jours pour les touristes français (exemption confirmée jusqu'au 1er janvier 2027). Garder le passeport SUR SOI : la loi mongole l'exige en permanence.","Rien à remplir avant. Pour le tour Tsaatan de 7 jours : le solde se paie en dollars cash, à prévoir avant de partir dans la taïga.","Le tugrik (MNT). Repère : 1 € ≈ 4 000 tugriks — les liasses de billets sont épaisses, les enfants vont adorer compter. Carte OK à Oulan-Bator, cash absolu partout ailleurs. Retirer PLUSIEURS jours d'avance avant le tour : dernier ATM = la capitale.","Repas local (buuz, khuushuur) : 15 000–25 000 MNT, soit 4 à 6 €.","Prises C/E, 220 V — vos chargeurs français passent. Dans la taïga : pas de prise du tout, batterie externe OBLIGATOIRE (une grosse, chargée à bloc).","SIM Unitel ou Mobicom à Oulan-Bator. Chez les Tsaatan : aucun réseau pendant plusieurs jours — prévenir les grands-parents AVANT, télécharger films et cartes.","Peu d'apps utiles hors capitale : ici on navigue au GPS et au guide. UBCab à Oulan-Bator, sinon taxi = n'importe quelle voiture qui s'arrête (courant et accepté, prix à convenir avant).","Eau du robinet : non. En tour : eau bouillie ou filtrée fournie par les guides.","Pas d'usage local. Pour l'équipe du tour (guide, cuisinier, chauffeur) : pourboire de fin de séjour très apprécié, en dollars ou tugriks.","À FAIRE : recevoir tout objet de la main droite ou des deux mains • si vous marchez sur le pied de quelqu'un, lui serrer la main aussitôt (la coutume qui amusera les enfants). À ÉVITER : toucher le chapeau ou la tête d'un Mongol • jeter quoi que ce soit dans un feu — le feu est sacré.","102 police · 103 ambulance","+6 h sur Paris. Le soir au camp, la France déjeune."
Chine,"Aucun visa jusqu'à 30 jours pour les Français (exemption valable jusqu'au 31 décembre 2026 — vous êtes pile dedans). Passeport valide 6 mois. Garder réservations d'hôtels et billets de sortie accessibles : parfois demandés à l'arrivée.","⚠️ CARTE D'ARRIVÉE ÉLECTRONIQUE obligatoire : formulaire en ligne à remplir avant le vol Oulan-Bator → Pékin (site officiel de l'immigration chinoise ou app « Immigration Bureau 12367 »). Un QR code par personne, enfants compris. À faire à l'hôtel la veille du départ.","Le yuan (CNY). Repère : 1 € ≈ 8 yuans. LE CHOC : le cash a presque disparu, tout se paie par téléphone. AVANT d'arriver : installer Alipay, y lier une carte française (ça marche très bien), et tout payer en scannant. Garder un peu de cash pour les marchés.","Repas de rue ou petit resto : 30–60 yuans, soit 4 à 8 €. Le canard laqué à Pékin : un banquet à ~25 €.","Prises A/C/I, 220 V — les prises chinoises sont souvent universelles et acceptent nos fiches, mais UN adaptateur universel dans le sac évite toute surprise.","⚠️ LE point crucial : Google, WhatsApp, Instagram, Gmail sont BLOQUÉS. Installer un VPN fiable AVANT d'entrer en Chine (impossible après) + prendre une eSIM voyage type Airalo/Holafly qui contourne le blocage. Sans ça : silence radio total de 13 jours pour les grands-parents.","Alipay = payer partout. DiDi = le taxi (intégré dans Alipay, pratique). Amap ou Apple Plans = cartes (Google Maps ne marche pas). Trip.com = trains et vols. Un traducteur hors ligne (l'anglais est rare).","Eau du robinet : non, jamais. Bouilloire dans chaque hôtel, tradition de l'eau chaude.","Pas de pourboire en Chine — il peut même être refusé ou gêner. On ne laisse rien, c'est la norme.","À FAIRE : slurper ses nouilles (c'est poli !) • goûter à tout, montrer qu'on se régale. À ÉVITER : planter ses baguettes debout dans le riz (geste funéraire) • se vexer dans une file d'attente — le concept y est… souple.","110 police · 120 ambulance","+6 h sur Paris. Et UN SEUL fuseau pour toute la Chine, d'ouest en est — fun fact vécu."
Hong-Kong,"Aucun visa jusqu'à 90 jours pour les Français. Attention au détail : passeport valide au moins 1 mois après la fin du séjour — et sortir de Chine continentale pour entrer à Hong-Kong compte comme une vraie frontière.","Rien à remplir : Hong-Kong a ses propres règles, plus simples que la Chine. Et bonus : Google, WhatsApp et Instagram REMARCHENT ici — la parenthèse connectée.","Le dollar de Hong Kong (HKD). Repère : 1 € ≈ 9 HK$. La carte passe partout, mais LE réflexe local : la carte Octopus (une par personne, rechargeable) — métro, ferry, tram, supérettes, tout se paie en bipant. Les enfants vont se battre pour biper.","Dim sum pour quatre : 250–400 HK$ (~30–45 €). Un bol de nouilles wonton : 50–70 HK$ (~6–8 €).","Prises G (type UK, 3 broches) — ADAPTATEUR OBLIGATOIRE, le premier du voyage.","eSIM ou SIM locale (csl, 3HK) très simple. Wifi rapide partout. Aucun blocage : rattraper 13 jours de photos à poster.","Octopus (l'app ou la carte physique) • MTR Mobile pour le métro • Uber existe, les taxis rouges sont partout (cash ou Octopus).","Eau du robinet : officiellement potable — dans les faits, tout le monde boit filtrée ou bouteille. On fait pareil.","Service de 10 % souvent déjà compté au resto. Sinon : on arrondit, taxis compris. Pas de pression.","À FAIRE : se tenir à DROITE sur les escalators (les locaux montent à gauche, vite) • monter à l'étage du tram à impériale. À ÉVITER : manger ou boire dans le métro — c'est une vraie amende • pointer avec ses baguettes.","999 (comme à Londres — héritage britannique)","+6 h sur Paris."
Malaisie,"Aucun visa jusqu'à 90 jours pour les Français.","⚠️ MDAC obligatoire : la « Malaysia Digital Arrival Card », formulaire GRATUIT en ligne (site officiel imigresen-online.imi.gov.my/mdac), à remplir dans les 3 JOURS avant CHAQUE entrée en Malaisie. Pour vous : avant l'arrivée du 25 août (nuit à KL). Un formulaire par personne. En simple transit international sans passer l'immigration : pas besoin.","Le ringgit (MYR). Repère : 1 € ≈ 5 ringgits — division par 5, facile. Carte acceptée partout à KL, cash pour la street food. ATM partout.","LE paradis de la street food : un plat au hawker centre (nasi lemak, satay, laksa) = 10–20 ringgits, soit 2 à 4 €. Le meilleur rapport régal/prix du voyage.","Prises G (type UK) — le même adaptateur qu'à Hong-Kong ressert.","eSIM ou SIM Hotlink/CelcomDigi à l'aéroport, pas chère, 4G/5G excellente. Aucun blocage.","Grab = taxi ET livraison de bouffe, l'app reine d'Asie du Sud-Est (créée ici !). Touch 'n Go eWallet si vous restez plus longtemps.","Eau du robinet : déconseillée. Bouteilles.","Pas d'usage : le service de 10 % est souvent inclus. On arrondit si on veut.","À FAIRE : manger et donner de la main DROITE • se couvrir épaules et genoux dans les mosquées (Emma et Marion : foulard fourni en général). À ÉVITER : pointer quelqu'un de l'index (utiliser le pouce, main fermée) • toucher la tête de quelqu'un, même d'un enfant.","999","+6 h sur Paris."
Indonésie,"⚠️ LE SEUL VISA PAYANT DU VOYAGE : visa à l'arrivée (VOA) de 30 jours, 500 000 IDR ≈ 35 US$ (~33 €) PAR PERSONNE — soit ~130 € pour les quatre. LE BON PLAN : le e-VOA en ligne AVANT le départ sur evisa.imigrasi.go.id (éviter la file après le vol). Passeport valide 6 mois + 2 pages vierges chacun. Ne pas dépasser les 30 jours : amende de 1 M IDR (~60 €) PAR JOUR.","⚠️ Formulaire « All Indonesia » obligatoire (douane + santé fusionnées) : en ligne dans les 72 h avant l'arrivée, UN PAR PERSONNE enfants compris, QR code à l'appui. Et si passage à Bali : taxe « Love Bali » de 150 000 IDR (~9 €) par personne, payable en ligne (lovebali.baliprov.go.id).","La roupie (IDR). Repère : 1 € ≈ 18 000 roupies — retirez 1 million, vous êtes millionnaires (les enfants adorent). Cash roi dans les warungs et les îles, carte dans les hôtels. ATM : privilégier ceux des banques (BCA, Mandiri), plafond bas par retrait.","Un nasi goreng au warung : 25 000–50 000 IDR, soit 1,50 à 3 € — le repas le moins cher du voyage. Un jus de fruits frais : moins d'1 €.","Prises C/F comme en France, 230 V — on finit le voyage sans adaptateur, la boucle est bouclée.","eSIM ou SIM Telkomsel (la meilleure couverture d'île en île). Bonne 4G presque partout, plus fragile sur les bateaux et à Komodo.","Gojek et Grab = taxis, scooters, livraison — les deux marchent, comparer les prix est un sport local. Bluebird = les taxis compteurs fiables.","Eau du robinet : JAMAIS, même pour les dents (le fameux « Bali belly » guette). Bouteilles scellées ou gourde filtrante.","Pas obligatoire : 5–10 % apprécié dans les restos, petits billets pour les porteurs et guides. Les équipes de la croisière Komodo : cagnotte de fin très bienvenue.","À FAIRE : main droite pour donner et recevoir • sarong aux temples (prêté sur place) • ENJAMBER les petites offrandes de fleurs sur les trottoirs (canang sari), jamais marcher dessus. À ÉVITER : toucher la tête de quelqu'un • s'énerver — ici, sourire résout tout.","112 (se déploie) · 110 police · 118 ambulance","+5 h sur Paris à Sumatra et Java, +6 h à Bali, Lombok et Komodo — oui, vous changerez d'heure À L'INTÉRIEUR du pays."
